{
  "schema": "fireviewer.omniverse-progressive-perimeter-layer-contract.v1",
  "contract_version": 1,
  "contract_status": "candidate_pending_die_visual_acceptance",
  "layer_package": {
    "layer_package_id": "die-2026-progressive-perimeters-r1",
    "revision": 1,
    "entry_layer": "perimeters.usda",
    "entry_layer_sha256": null,
    "manifest_sha256": null
  },
  "base_map": {
    "contract_record": "examples/die-map-upload.candidate.json",
    "contract_record_sha256": "37cc0e9e47e9535892579525fa2cd6384ce09cc735acc6e6863bea1213a39a45",
    "package_id": "fireviewer-die-pontaix-map-r5",
    "revision": 5,
    "required_status": "active",
    "acceptance_receipt_sha256": null
  },
  "progression": {
    "production_mode": "progressive_separate_layer_revisions",
    "source_record": "source/die-2026-v1.json",
    "source_sha256": "9a1743f84aae2283d251d689b842ed34363e56b2da6c0807e3aec750e5cc9e7d",
    "source_crs": "EPSG:4326",
    "layer_crs": "EPSG:2154",
    "geometry_role": "cumulative_fire_perimeter",
    "state_count": 21,
    "first_local_date": "2026-07-03",
    "last_local_date": "2026-07-23",
    "ordered": true,
    "append_only": true,
    "state_records": [
      {"append_order": 1, "state_id": "perimeter_001", "layer_revision_id": "die-2026-07-03-active-zone-v3", "local_date": "2026-07-03", "valid_at": "2026-07-03T18:00:00Z", "source_selector": "#/activity_zones/0/geometry_geojson/global_footprint_geojson", "geometry_type": "MultiPolygon", "layer_path": "states/perimeter_001.usda", "layer_sha256": null},
      {"append_order": 2, "state_id": "perimeter_002", "layer_revision_id": "die-2026-07-04-active-zone-v3", "local_date": "2026-07-04", "valid_at": "2026-07-04T18:00:00Z", "source_selector": "#/activity_zones/1/geometry_geojson/global_footprint_geojson", "geometry_type": "MultiPolygon", "layer_path": "states/perimeter_002.usda", "layer_sha256": null},
      {"append_order": 3, "state_id": "perimeter_003", "layer_revision_id": "die-2026-07-05-active-zone-v3", "local_date": "2026-07-05", "valid_at": "2026-07-05T15:54:00Z", "source_selector": "#/activity_zones/2/geometry_geojson/global_footprint_geojson", "geometry_type": "MultiPolygon", "layer_path": "states/perimeter_003.usda", "layer_sha256": null},
      {"append_order": 4, "state_id": "perimeter_004", "layer_revision_id": "die-2026-07-06-active-zone-v3", "local_date": "2026-07-06", "valid_at": "2026-07-06T18:40:00Z", "source_selector": "#/activity_zones/3/geometry_geojson/global_footprint_geojson", "geometry_type": "MultiPolygon", "layer_path": "states/perimeter_004.usda", "layer_sha256": null},
      {"append_order": 5, "state_id": "perimeter_005", "layer_revision_id": "die-2026-07-07-active-zone-v3", "local_date": "2026-07-07", "valid_at": "2026-07-07T10:28:00Z", "source_selector": "#/activity_zones/4/geometry_geojson/global_footprint_geojson", "geometry_type": "MultiPolygon", "layer_path": "states/perimeter_005.usda", "layer_sha256": null},
      {"append_order": 6, "state_id": "perimeter_006", "layer_revision_id": "die-2026-07-08-active-zone-v3", "local_date": "2026-07-08", "valid_at": "2026-07-08T10:20:00Z", "source_selector": "#/activity_zones/5/geometry_geojson/global_footprint_geojson", "geometry_type": "MultiPolygon", "layer_path": "states/perimeter_006.usda", "layer_sha256": null},
      {"append_order": 7, "state_id": "perimeter_007", "layer_revision_id": "die-2026-07-09-active-zone-v3", "local_date": "2026-07-09", "valid_at": "2026-07-09T08:44:00Z", "source_selector": "#/activity_zones/6/geometry_geojson/global_footprint_geojson", "geometry_type": "MultiPolygon", "layer_path": "states/perimeter_007.usda", "layer_sha256": null},
      {"append_order": 8, "state_id": "perimeter_008", "layer_revision_id": "die-2026-07-10-active-zone-v3", "local_date": "2026-07-10", "valid_at": "2026-07-10T10:36:00Z", "source_selector": "#/activity_zones/7/geometry_geojson/global_footprint_geojson", "geometry_type": "MultiPolygon", "layer_path": "states/perimeter_008.usda", "layer_sha256": null},
      {"append_order": 9, "state_id": "perimeter_009", "layer_revision_id": "die-2026-07-11-active-zone-v3", "local_date": "2026-07-11", "valid_at": "2026-07-11T18:00:00Z", "source_selector": "#/activity_zones/8/geometry_geojson/global_footprint_geojson", "geometry_type": "MultiPolygon", "layer_path": "states/perimeter_009.usda", "layer_sha256": null},
      {"append_order": 10, "state_id": "perimeter_010", "layer_revision_id": "die-2026-07-12-active-zone-v3", "local_date": "2026-07-12", "valid_at": "2026-07-12T18:00:00Z", "source_selector": "#/activity_zones/8/geometry_geojson/global_footprint_geojson", "geometry_type": "MultiPolygon", "layer_path": "states/perimeter_010.usda", "layer_sha256": null},
      {"append_order": 11, "state_id": "perimeter_011", "layer_revision_id": "die-2026-07-13-active-zone-v3", "local_date": "2026-07-13", "valid_at": "2026-07-13T18:45:00Z", "source_selector": "#/activity_zones/8/geometry_geojson/global_footprint_geojson", "geometry_type": "MultiPolygon", "layer_path": "states/perimeter_011.usda", "layer_sha256": null},
      {"append_order": 12, "state_id": "perimeter_012", "layer_revision_id": "die-2026-07-14-active-zone-v3", "local_date": "2026-07-14", "valid_at": "2026-07-14T18:00:00Z", "source_selector": "#/activity_zones/8/geometry_geojson/global_footprint_geojson", "geometry_type": "MultiPolygon", "layer_path": "states/perimeter_012.usda", "layer_sha256": null},
      {"append_order": 13, "state_id": "perimeter_013", "layer_revision_id": "die-2026-07-15-active-zone-v3", "local_date": "2026-07-15", "valid_at": "2026-07-15T18:00:00Z", "source_selector": "#/activity_zones/8/geometry_geojson/global_footprint_geojson", "geometry_type": "MultiPolygon", "layer_path": "states/perimeter_013.usda", "layer_sha256": null},
      {"append_order": 14, "state_id": "perimeter_014", "layer_revision_id": "die-2026-07-16-active-zone-v3", "local_date": "2026-07-16", "valid_at": "2026-07-16T09:00:00Z", "source_selector": "#/activity_zones/8/geometry_geojson/global_footprint_geojson", "geometry_type": "MultiPolygon", "layer_path": "states/perimeter_014.usda", "layer_sha256": null},
      {"append_order": 15, "state_id": "perimeter_015", "layer_revision_id": "die-2026-07-17-active-zone-v3", "local_date": "2026-07-17", "valid_at": "2026-07-17T18:00:00Z", "source_selector": "#/activity_zones/8/geometry_geojson/global_footprint_geojson", "geometry_type": "MultiPolygon", "layer_path": "states/perimeter_015.usda", "layer_sha256": null},
      {"append_order": 16, "state_id": "perimeter_016", "layer_revision_id": "die-2026-07-18-active-zone-v3", "local_date": "2026-07-18", "valid_at": "2026-07-18T10:00:00Z", "source_selector": "#/activity_zones/8/geometry_geojson/global_footprint_geojson", "geometry_type": "MultiPolygon", "layer_path": "states/perimeter_016.usda", "layer_sha256": null},
      {"append_order": 17, "state_id": "perimeter_017", "layer_revision_id": "die-2026-07-19-active-zone-v3", "local_date": "2026-07-19", "valid_at": "2026-07-19T18:00:00Z", "source_selector": "#/activity_zones/8/geometry_geojson/global_footprint_geojson", "geometry_type": "MultiPolygon", "layer_path": "states/perimeter_017.usda", "layer_sha256": null},
      {"append_order": 18, "state_id": "perimeter_018", "layer_revision_id": "die-2026-07-20-active-zone-v3", "local_date": "2026-07-20", "valid_at": "2026-07-20T18:00:00Z", "source_selector": "#/activity_zones/8/geometry_geojson/global_footprint_geojson", "geometry_type": "MultiPolygon", "layer_path": "states/perimeter_018.usda", "layer_sha256": null},
      {"append_order": 19, "state_id": "perimeter_019", "layer_revision_id": "die-2026-07-21-active-zone-v3", "local_date": "2026-07-21", "valid_at": "2026-07-21T17:00:00Z", "source_selector": "#/activity_zones/8/geometry_geojson/global_footprint_geojson", "geometry_type": "MultiPolygon", "layer_path": "states/perimeter_019.usda", "layer_sha256": null},
      {"append_order": 20, "state_id": "perimeter_020", "layer_revision_id": "die-2026-07-22-active-zone-v3", "local_date": "2026-07-22", "valid_at": "2026-07-22T06:00:00Z", "source_selector": "#/activity_zones/8/geometry_geojson/global_footprint_geojson", "geometry_type": "MultiPolygon", "layer_path": "states/perimeter_020.usda", "layer_sha256": null},
      {"append_order": 21, "state_id": "perimeter_021", "layer_revision_id": "die-2026-07-23-active-zone-v3", "local_date": "2026-07-23", "valid_at": "2026-07-23T18:00:00Z", "source_selector": "#/activity_zones/8/geometry_geojson/global_footprint_geojson", "geometry_type": "MultiPolygon", "layer_path": "states/perimeter_021.usda", "layer_sha256": null}
    ]
  },
  "rendering": {
    "composition_mode": "optional_sublayer_over_base_map",
    "visualization_only": true,
    "timeline_mode": "timestamp_selects_single_perimeter_layer",
    "seconds_per_day": 60.0,
    "trace_enabled": true,
    "fill_enabled": true,
    "color_policy": "chronological_palette",
    "trace_width_m": 8.0,
    "fill_opacity": 0.24,
    "terrain_offset_m": 1.0,
    "legend_required": true
  },
  "content_boundary": {
    "embedded_in_map_upload": false,
    "simulation_enabled": false,
    "camera_rig_present": false,
    "flow_present": false,
    "flames_present": false,
    "smoke_present": false,
    "tree_destruction_present": false,
    "capture_present": false
  },
  "quality_gates": {
    "base_map_active": "pending",
    "source_integrity": "passed",
    "geometry_validation": "pending",
    "crs_projection": "pending",
    "progression_order": "pending",
    "usd_validation": "pending",
    "trace_and_color_render": "pending",
    "human_visual_review": "pending"
  },
  "release": {
    "human_visual_decision": "pending",
    "acceptance_receipt_sha256": null,
    "layer_attachment_allowed": false,
    "automatic_map_mutation": false,
    "automatic_publication": false
  }
}
